id,title,doi,publication_year,authors,abstract,open_access,host_venue
https://openalex.org/W3046375318,Domain-Specific Language Model Pretraining for Biomedical Natural Language Processing,https://doi.org/10.1145/3458754,2021,"裕二 池谷, Robert Tinn, Hao Cheng, Michael Lucas, Naoto Usuyama, Xiaodong Liu, Tristan Naumann, Jianfeng Gao, Hoifung Poon","Pretraining large neural language models, such as BERT, has led to impressive gains on many natural language processing (NLP) tasks. However, most pretraining efforts focus on general domain corpora, such as newswire and Web. A prevailing assumption is that even domain-specific pretraining can benefit by starting from general-domain language models. In this article, we challenge this assumption by showing that for domains with abundant unlabeled text, such as biomedicine, pretraining language models from scratch results in substantial gains over continual pretraining of general-domain language models. To facilitate this investigation, we compile a comprehensive biomedical NLP benchmark from publicly available datasets. Our experiments show that domain-specific pretraining serves as a solid foundation for a wide range of biomedical NLP tasks, leading to new state-of-the-art results across the board. Further, in conducting a thorough evaluation of modeling choices, both for pretraining and task-specific fine-tuning, we discover that some common practices are unnecessary with BERT models, such as using complex tagging schemes in named entity recognition. To help accelerate research in biomedical NLP, we have released our state-of-the-art pretrained and task-specific models for the community, and created a leaderboard featuring our BLURB benchmark (short for Biomedical Language Understanding &amp; Reasoning Benchmark) at https://aka.ms/BLURB .",True,
https://openalex.org/W1502957213,Proceedings of the 2016 Conference on Empirical Methods in Natural Language Processing,https://doi.org/10.18653/v1/d16-1,2016,"Christos Christodoulopoulos, Sharon Goldwater, Mark Steedman",,False,
https://openalex.org/W2117400858,Transformation-based error-driven learning and natural language processing: a case study in part-of-speech tagging,,1995,Eric Brill,"Recently, there has been a rebirth of empiricism in the field of natural language processing. Manual encoding of linguistic information is being challenged by automated corpus-based learning as a method of providing a natural language processing system with linguistic knowledge. Although corpus-based approaches have been successful in many different areas of natural language processing, it is often the case that these methods capture the linguistic information they are modelling indirectly in large opaque tables of statistics. This can make it difficult to analyze, understand and improve the ability of these approaches to model underlying linguistic behavior. In this paper, we will describe a simple rule-based approach to automated learning of linguistic knowledge. This approach has been shown for a number of tasks to capture information in a clearer and more direct fashion without a compromise in performance. We present a detailed case study of this learning method applied to part-of-speech tagging.",False,
https://openalex.org/W3144293453,Natural Language Processing,https://doi.org/10.1007/978-81-322-3972-7_19,2020,K. R. Chowdhary,,False,
https://openalex.org/W2747680751,"Natural language processing: state of the art, current trends and challenges",https://doi.org/10.1007/s11042-022-13428-4,2022,"Diksha Khurana, Aditya Koli, Kiran Khatter, Sukhdev Singh",,True,
https://openalex.org/W2147272182,Introduction to Arabic Natural Language Processing,https://doi.org/10.1007/978-3-031-02139-8,2010,Nizar Habash,This book provides system developers and researchers in natural language processing and computational linguistics with the necessary background information for working with the Arabic language. The go,False,
https://openalex.org/W4237040408,Proceedings of the 2017 Conference on Empirical Methods in Natural Language Processing,https://doi.org/10.18653/v1/d17-1,2017,"Chloé Braud, Ophélie Lacroix, Anders Søgaard","Discourse segmentation is the first step in building discourse parsers.Most work on discourse segmentation does not scale to real-world discourse parsing across languages, for two reasons: (i) models rely on constituent trees, and (ii) experiments have relied on gold standard identification of sentence and token boundaries.We therefore investigate to what extent constituents can be replaced with universal dependencies, or left out completely, as well as how state-of-the-art segmenters fare in the absence of sentence boundaries.Our results show that dependency information is less useful than expected, but we provide a fully scalable, robust model that only relies on part-of-speech information, and show that it performs well across languages in the absence of any gold-standard annotation.",True,
https://openalex.org/W2587019100,Comparative Study of CNN and RNN for Natural Language Processing,https://doi.org/10.48550/arxiv.1702.01923,2017,"Wenpeng Yin, Katharina Kann, Mo Yu, Hinrich Schütze","Deep neural networks (DNN) have revolutionized the field of natural language processing (NLP). Convolutional neural network (CNN) and recurrent neural network (RNN), the two main types of DNN architectures, are widely explored to handle various NLP tasks. CNN is supposed to be good at extracting position-invariant features and RNN at modeling units in sequence. The state of the art on many NLP tasks often switches due to the battle between CNNs and RNNs. This work is the first systematic comparison of CNN and RNN on a wide range of representative NLP tasks, aiming to give basic guidance for DNN selection.",True,
https://openalex.org/W2606089314,Neural Network Methods for Natural Language Processing,https://doi.org/10.1007/978-3-031-02165-7,2017,Yoav Goldberg,Neural networks are a family of powerful machine learning models. This book focuses on the application of neural network models to natural language data. The first half of the book (Parts I and II) co,False,
https://openalex.org/W2045812729,Foundations of statistical natural language processing,https://doi.org/10.1145/601858.601867,2002,Gerhard Weikum,No abstract available.,False,
https://openalex.org/W1563635790,Strategies for Natural Language Processing,https://doi.org/10.4324/9781315802671,2014,"Wendy G. Lehnert, Martin Ringle",,False,
https://openalex.org/W4210984920,Neural Network Methods for Natural Language Processing,https://doi.org/10.2200/s00762ed1v01y201703hlt037,2017,Yoav Goldberg,Neural networks are a family of powerful machine learning models. This book focuses on the application of neural network models to natural language data. The first half of the book (Parts I and II) co,True,
https://openalex.org/W1984708705,Arabic Natural Language Processing,https://doi.org/10.1145/1644879.1644881,2009,"Ali Farghaly, Khaled Shaalan","The Arabic language presents researchers and developers of natural language processing (NLP) applications for Arabic text and speech with serious challenges. The purpose of this article is to describe some of these challenges and to present some solutions that would guide current and future practitioners in the field of Arabic natural language processing (ANLP). We begin with general features of the Arabic language in Sections 1, 2, and 3 and then we move to more specific properties of the language in the rest of the article. In Section 1 of this article we highlight the significance of the Arabic language today and describe its general properties. Section 2 presents the feature of Arabic Diglossia showing how the sociolinguistic aspects of the Arabic language differ from other languages. The stability of Arabic Diglossia and its implications for ANLP applications are discussed and ways to deal with this problematic property are proposed. Section 3 deals with the properties of the Arabic script and the explosion of ambiguity that results from the absence of short vowel representations and overt case markers in contemporary Arabic texts. We present in Section 4 specific features of the Arabic language such as the nonconcatenative property of Arabic morphology, Arabic as an agglutinative language, Arabic as a pro-drop language, and the challenge these properties pose to ANLP. We also present solutions that have already been adopted by some pioneering researchers in the field. In Section 5 we point out to the lack of formal and explicit grammars of Modern Standard Arabic which impedes the progress of more advanced ANLP systems. In Section 6 we draw our conclusion.",False,
https://openalex.org/W2028140375,Jumping NLP Curves: A Review of Natural Language Processing Research [Review Article],https://doi.org/10.1109/mci.2014.2307227,2014,"Erik Cambria, Bebo White","Natural language processing (NLP) is a theory-motivated range of computational techniques for the automatic analysis and representation of human language. NLP research has evolved from the era of punch cards and batch processing (in which the analysis of a sentence could take up to 7 minutes) to the era of Google and the likes of it (in which millions of webpages can be processed in less than a second). This review paper draws on recent developments in NLP research to look at the past, present, and future of NLP technology in a new light. Borrowing the paradigm of `jumping curves' from the field of business management and marketing prediction, this survey article reinterprets the evolution of NLP research as the intersection of three overlapping curves-namely Syntactics, Semantics, and Pragmatics Curveswhich will eventually lead NLP research to evolve into natural language understanding.",False,
https://openalex.org/W2596567068,Proceedings of the 2015 Conference on Empirical Methods in Natural Language Processing,https://doi.org/10.18653/v1/d15-1,2015,,,False,
https://openalex.org/W3031696893,Attention in Natural Language Processing,https://doi.org/10.1109/tnnls.2020.3019893,2020,"Andrea Galassi, Marco Lippi, Paolo Torroni","Attention is an increasingly popular mechanism used in a wide range of neural architectures. The mechanism itself has been realized in a variety of formats. However, because of the fast-paced advances in this domain, a systematic overview of attention is still missing. In this article, we define a unified model for attention architectures in natural language processing, with a focus on those designed to work with vector representations of the textual data. We propose a taxonomy of attention models according to four dimensions: the representation of the input, the compatibility function, the distribution function, and the multiplicity of the input and/or output. We present the examples of how prior information can be exploited in attention models and discuss ongoing research efforts and open challenges in the area, providing the first extensive categorization of the vast body of literature in this exciting domain.",True,
https://openalex.org/W1554540371,Proceedings of the 2011 Conference on Empirical Methods in Natural Language Processing,,2011,"Kristian Woodsend, Mirella Lapata",,False,
https://openalex.org/W1603598191,Proceedings of the 2003 conference on Empirical methods in natural language processing -,https://doi.org/10.3115/1119355,2003,"Michael Collins, Mark Steedman","In this paper, we describe a phrase-based unigram model for statistical machine translation that uses a much simpler set of model parameters than similar phrase-based models. The units of translation are blocks -- pairs of phrases. During decoding, we ...",False,
https://openalex.org/W2489487449,Proceedings of the 2020 Conference on Empirical Methods in Natural Language Processing (EMNLP),https://doi.org/10.18653/v1/2020.emnlp-main,2020,,"Welcome to EMNLP 2020!Due to the unprecedented situation with the Covid-19 pandemic, EMNLP 2020 will be held completely online this year.We decided to move EMNLP to a virtual format early on, when the pandemic just started, and postponed the paper submission deadlines by three weeks such that authors affected by the pandemic could have more time for their paper submissions.This resulted in a much tighter schedule for paper review and decisions, as well as publications, workshop programs, virtual infrastructure, etc.However, thanks to everyone's hard work, we made it.We received a record number of 3,677 submissions.This is a significant increase of 26% over EMNLP 2019, making it the largest NLP conference to date in terms of paper submissions.After removing withdrawals and desk rejecting papers which violated our formatting requirements, the anonymity policy, or double submission policy, 3,359 submissions were sent out for review.Despite the sharp increase in submissions, we kept the acceptance rates at a similar level as past years.",True,
https://openalex.org/W2953958347,Transfer Learning in Natural Language Processing,https://doi.org/10.18653/v1/n19-5004,2019,"Sebastian Ruder, Matthew E. Peters, Swabha Swayamdipta, Thomas Wolf","The classic supervised machine learning paradigm is based on learning in isolation, a single predictive model for a task using a single dataset. This approach requires a large number of training examples and performs best for well-defined and narrow tasks. Transfer learning refers to a set of methods that extend this approach by leveraging data from additional domains or tasks to train a model with better generalization properties. Over the last two years, the field of Natural Language Processing (NLP) has witnessed the emergence of several transfer learning methods and architectures which significantly improved upon the state-of-the-art on a wide range of NLP tasks. These improvements together with the wide availability and ease of integration of these methods are reminiscent of the factors that led to the success of pretrained word embeddings and ImageNet pretraining in computer vision, and indicate that these methods will likely become a common tool in the NLP landscape as well as an important research direction. We will present an overview of modern transfer learning methods in NLP, how models are pre-trained, what information the representations they learn capture, and review examples and case studies on how these models can be integrated and adapted in downstream NLP tasks.",False,
https://openalex.org/W2964091467,Ask Me Anything: Dynamic Memory Networks for Natural Language Processing,https://doi.org/10.48550/arxiv.1506.07285,2015,"Ankit Kumar, Ozan İrsoy, Peter Ondrúška, Mohit Iyyer, James Bradbury, Ishaan Gulrajani, Victor W. Zhong, Romain Paulus, Richard Socher","Most tasks in natural language processing can be cast into question answering (QA) problems over language input. We introduce the dynamic memory network (DMN), a neural network architecture which processes input sequences and questions, forms episodic memories, and generates relevant answers. Questions trigger an iterative attention process which allows the model to condition its attention on the inputs and the result of previous iterations. These results are then reasoned over in a hierarchical recurrent sequence model to generate answers. The DMN can be trained end-to-end and obtains state-of-the-art results on several types of tasks and datasets: question answering (Facebook's bAbI dataset), text classification for sentiment analysis (Stanford Sentiment Treebank) and sequence modeling for part-of-speech tagging (WSJ-PTB). The training for these different tasks relies exclusively on trained word vector representations and input-question-answer triplets.",True,
https://openalex.org/W2338526423,Natural Language Processing in Radiology: A Systematic Review,https://doi.org/10.1148/radiol.16142770,2016,"Ewoud Pons, Loes Braun, M. G. Myriam Hunink, Jan A. Kors","Radiological reporting has generated large quantities of digital content within the electronic health record, which is potentially a valuable source of information for improving clinical care and supporting research. Although radiology reports are stored for communication and documentation of diagnostic imaging, harnessing their potential requires efficient and automated information extraction: they exist mainly as free-text clinical narrative, from which it is a major challenge to obtain structured data. Natural language processing (NLP) provides techniques that aid the conversion of text into a structured representation, and thus enables computers to derive meaning from human (ie, natural language) input. Used on radiology reports, NLP techniques enable automatic identification and extraction of information. By exploring the various purposes for their use, this review examines how radiology benefits from NLP. A systematic literature search identified 67 relevant publications describing NLP methods that support practical applications in radiology. This review takes a close look at the individual studies in terms of tasks (ie, the extracted information), the NLP methodology and tools used, and their application purpose and performance results. Additionally, limitations, future challenges, and requirements for advancing NLP in radiology will be discussed.",False,
