title,authors,year,doi,full_text,clean_text,keywords
"From Cyber Security Incident Management to Cyber Security Crisis
  Management in the European Union","['Jukka Ruohonen', 'Kalle Rindell', 'Simone Busetti']",2025,http://arxiv.org/abs/2504.14220v1,"From Cyber Security Incident Management to
Cyber Security Crisis Management in the European Union
Jukka Ruohonena,∗, Kalle Rindellb, Simone Busettic
aUniversity of Southern Denmark, Denmark
bUniversity of Turku, Finland
cUniversity of Teramo, Italy
Abstract
Incident management is a classical topic in cyber security. Recently, the European Union (EU) has started to consider
also the relation between cyber security incidents and cyber security crises. These considerations and preparations,
including those specified in the EU’s new cyber security laws, constitute the paper’s topic. According to an analysis of
the laws and associated policy documents, (i) cyber security crises are equated in the EU to large-scale cyber security
incidents that either exceed a handling capacity of a single member state or affect at least two member states. For this
and other purposes, (ii) the new laws substantially increase mandatory reporting about cyber security incidents, including
but not limited to the large-scale incidents. Despite the laws and new governance bodies established by them, however,
(iii) the working of actual cyber security crisis management remains unclear particularly at the EU-level. With these
policy research results, the paper advances the domain of cyber security incident management research by elaborating
how European law perceives cyber security crises and their relation to cyber security incidents, paving the way for many
relevant further research topics with practical relevance, whether theoretical, conceptual, or empirical.
Keywords: risk management, risk analysis, incident management, crisis management, regulations, governance, EU
1. Introduction
“Europe has been in crisis management mode for a
decade and a half” (Handler, 2024, p. 1). Although the
statement quoted is true in many respects, it does not
(yet) apply to the cyber security domain. In other words,
to the best of the authors’ knowledge, there has not been a
truly large-scale, pan-European cyber security crisis thus
far. This statement does not mean that the EU would
not have prepared for such a crisis. These preparations,
including those mandated by the EU’s new cyber security
laws, are what the paper is about. The paper’s relevance
and contributions can be elaborated with four brief points.
To start from practical relevance, first, the topic is
timely. In fact, the European Commission (EC) just re-
cently released a new proposal for handling large-scale,
cross-country cyber security crises in Europe (EC, 2025a).
The second point follows from this timeliness; again to
the best of the authors’ knowledge, the paper is the first
to elaborate cyber security crisis management in the EU
context. While there are some existing works, they have
concentrated on national cyber security crisis manage-
ment (Boeke, 2017; Collier, 2016; Østby and Katt, 2020).
That is, the EU context has been missing thus far, includ-
ing with respect to the EU’s new judicial framework. In
∗Corresponding author.
Email address: juk@mmmi.sdu.dk (Jukka Ruohonen)addition, governance below national administrations has
received limited attention in general (B´ eland et al., 2024).
Subsequently, third, the paper contributes to the recent ef-
forts to digest and analyze the EU’s many new cyber secu-
rity laws and their implications (Alexopoulos et al., 2025;
Busetti and Scanni, 2025; Mueck and Gaie, 2025; Rataj,
2025; Ruohonen, 2024b; Ruohonen et al., 2025, among
many others). Regarding existing research and knowledge
more generally, fourth and last, the paper contributes to
the incident management research domain by elaborating,
analyzing, and theorizing on how incidents are related to
and may transform into crises. Because crises typically
have immense consequences, the paper’s overall relevance
is well-justified; it is important to understand how the
EU’s new cyber security legal framework is designed with
crisis management in mind.
With respect to the last point, both incident manage-
ment research and frameworks for it have traditionally op-
erated at the organizational level; incidents are something
that organizations may face, and thus they should also pre-
pare for them. For instance, a classical incident manage-
ment framework from the National Institute of Standards
and Technology (NIST) defines cyber security incident as
“a violation or imminent threat of violation” of any cy-
ber “security policies, acceptable use policies, or standard
security practices” established and enforced by organiza-
tions (Cichonski et al., 2012, p. 6). The organizational fo-
cus is thus clear. According to an early literature review,
Preprint submitted to Elsevier April 22, 2025arXiv:2504.14220v1  [cs.CR]  19 Apr 2025
a similar focus is present in many other well-known frame-
works and standards for incident management and closely
related topics (Tøndel et al., 2014). From the previous
quotation it also follows that an organization should have
cyber security policies established and enforced because
otherwise an incident remains only implicit and vaguely
defined. A similar claim applies to cyber security crisis
management; also larger entities, whether industry sec-
tors, geographic regions, or countries and beyond, should
have policies in place for handling cyber security crises.
As will be seen, in the EU these policies are partially but
still explicitly written in recent cyber security laws.
A further point about the organizational focus is that it
has typically been present also in different socio-technical
frameworks for incident management and cyber security
management in general (Al Sabbagh and Kowalski, 2015;
Jaatun et al., 2009; van Haastrecht et al., 2021). Moti-
vated by a recent work on layered cyber security frame-
works (Panteli et al., 2025), the paper adopts a multi-level
perspective sometimes used in the socio-technical frame-
works (Malatji et al., 2019), but extends it beyond orga-
nizations. Thus, the first part in the socio-technical term
refers to an adjective societal and particularly a noun Eu-
ropean. Although societal cyber security is not a well-
defined concept, it has sometimes been discussed in a con-
text of critical infrastructure protection (Gjesvik, 2019).
Such a framing serves also the paper’s purposes well be-
cause among the EU laws considered is an important new
law for critical infrastructure protection in Europe.
With these motivating remarks in mind, the following
three research questions (RQs) are examined:
•RQ.1: What constitutes a cyber security crisis in the
European Union?
•RQ.2: What do recent EU laws impose upon cyber
security incident and crisis management?
•RQ.3: How cyber security crises are managed, gov-
erned, and coordinated in the EU and by whom?
The paper’s remainder is structured into four sections.
The opening Section 2 motivates the background further,
including with respect to the multi-level approach pursued
and the EU laws considered. The methodology for analyz-
ing these is also elaborated, and a few clarifying framings
are also done to restrict and limit the paper’s scope. Sec-
tion 3 continues by elaborating how different law-imposed
incident types are related to the multi-level approach. In
general, the section answers to RQ.1 and RQ.2. The sub-
sequent Section 4 answers to RQ.3 by elaborating the var-
ious institutions, organizations, and networks involved in
cyber security crisis management in the EU context. The
final Section 5 presents a concluding discussion.2. Background
2.1. Framings
Some framings are required for limiting and aligning
the paper’s scope to a manageable composition. To be-
gin with, the paper is framed toward cyber security alone.
The paper’s opening quotation about Europe having been
in a crisis management mode for a long time helps to un-
derstand that crises vary a lot; from financial crises all
the way to wars and the existential climate change crisis.
While notions such as cascading effects and risks (Adkins
et al., 2020; Ruohonen, 2024a; Ruohonen et al., 2025) make
it understandable that many crises may be interconnected
to each other, no attempts are made to connect cyber se-
curity crises to other crises. The same applies regarding
threats. Some cyber security threats, including particu-
larly those related to advanced persistent threat (APT) ac-
tors, are today, in Europe, often perceived to be linked
with a broader class of so-called hybrid threats (Anagnos-
takis, 2023; Jungwirth et al., 2023). While acknowledging
the linkage’s theoretical and practical validity, no attempts
are made to move beyond plain cyber security. By implica-
tion, as hybrid threats may involve also a military dimen-
sion, also the EU’s other cyber security pillars (Christou,
2016; Ruohonen, 2024b), whether cyber defense or data
protection, are excluded from the paper’s scope. Further-
more, theorizing about different types of cyber security
crises are further omitted for brevity, clarity, and align-
ment with the EU’s laws.
With respect to large-scale cyber security crises, ENISA
(2024, p. 12) emphasizes a need to distinguish between a
creeping crisis, “which simmers under the radar” before
“suddenly and unexpectedly erupting”, an acute crisis,
“which is sudden, unforeseen and can have a massive im-
pact in a very short amount of time”, and a recurring cri-
sis, which occurs almost continuously. Similar categoriza-
tions have been presented in the academic literature (Boin
et al., 2018; Head, 2022). Of these three types, denial of
service attacks, in particular, could be seen as something
recurrent, whereas a severe data breach or a successful
ransomware attack might be seen to belong to the cate-
gory of acute crises. Though, these examples are more
about incidents than crises; therefore, also risk analysis is
presumably more challenging when trying to assess crises
rater than incidents; when operating at a level of societies
or beyond rather than at the conventional organizational
level. At the societal level, an example of a creeping crisis
might involve a discovered large-scale espionage campaign
conducted by an APT actor. Beyond these brief remarks,
as said, more elaborate theorization is left for further work.
2.2. Methodology
The paper operates in the domain of policy studies.
Within this domain, a separation between policy analysis
and policy (process) research is sometimes done. Broadly
2
speaking, the former is about prescriptive research seek-
ing to inform policy-making, whether in terms of evalua-
tions, impact assessments, or something else, while the lat-
ter is descriptive research focused particularly on theory-
building (DeLeon and Weible, 2010; Secchi, 2016). Given
this characterization, the paper is about policy research.
Regarding descriptive policy research, an ex post ,post hoc ,
or retrospective approach is used (cf. Patton et al., 2016).
This choice is also unavoidable because the EU laws con-
sidered have already been enacted.
Regarding ex ante policy analysis, it is worth remarking
that the EC did prior impact assessments for most—but
not all (EP, 2024)—of the laws considered in the paper.
For the paper’s purposes, it is particularly worth remark-
ing that these assessments indicated a lack of joint situa-
tional awareness and crisis management between the mem-
ber states, and between them and the EU-level administra-
tion; information sharing was concluded to operate on an
ad hoc basis and cross-border spillovers were omitted from
risk analyses (EC, 2020, pp. 21–22). This point justifies an
academic expert evaluation of the three RQs postulated.
Regarding theory-building, the paper analyzes and the-
orizes how the EU’s new laws align with common analyt-
ical frameworks used in incident and crisis management
research. On the side of engineering and computer sci-
ence, within which theory-building often has a different
meaning, the paper aligns with requirements engineering
research within which legal requirements are a distinct
genre (Ruohonen et al., 2025). This research branch jus-
tifies RQ.2. In other words, it is important to know what
laws require, whether from organizations, producers, or
public administrations. Once an answer is known, it is pos-
sible to continue toward empirical policy research; with-
out knowing the legal requirements, formulation of rele-
vant research questions is difficult—if not questionable al-
together. This point also applies to the framings done; in-
sofar as policy analysis is concerned, it is pointless to eval-
uate responses to hybrid threats without knowing about
the preparations and frameworks for handling them.
2.3. Analytical Levels
The paper’s conceptual and theoretical background can
be motivated by considering an analytical relation be-
tween incidents and crisis through different vertical levels
of analysis often used in social sciences. A term multi-
level analysis is sometimes used to refer to approaches
that operate at two or more such levels (B´ eland et al.,
2024; Hutzschenreuter et al., 2020). The term should not
be equated to multi-level (cyber) security, although there
is a rough conceptual similarity because both involve a hi-
erarchy (Anderson, 2020). In any case, an incident that
involves multiple analytical levels could be called a multi-
level incident—or, depending on which levels an incident
has transcended, a cyber security crisis.2.3.1. The International Level
The international level is at the top of the hierarchy.
When operating at this level, an analysis typically func-
tions horizontally, focusing on relations between states. In
terms of cyber security, good examples about such inter-
state, transnational relations would cover cyber norms, cy-
ber diplomacy, and even what is known and debated as
cyber war. However, as said, such topics are beyond the
paper’s scope. Another point is that it is also possible
to consider information systems and other technical solu-
tions at this level; such systems and solutions are those
that transcend both national and organizational bound-
aries (Rukanova et al., 2015). Such transcendence can also
been seen as something that separates cyber security inci-
dents from cyber security crises.
If a cyber security incident escalates to the international
level, it is not really any more a mere incident but rather
a crisis. With this point in mind, Fig. 1 displays seven an-
alytical levels through which incidents may become crises.
As can be seen, the impact is taken to increase the further
a cyber security event is from an incident.
IncidentCrisisIndividualOrganizationalSectoralRegionalNationalSupranationalInternational
Vertical
levelImpact
Horizontal 
governance 
at the same
vertical level
Figure 1: Analytical Levels (adopted from ENISA 2024, pp. 17–18)
2.3.2. The Supranational Level
Below the international level is a supranational level.
This level is at which the EU operates; the European
Union is a supranational union. At the same time, how-
ever, it operates in intergovernmental terms; the Council
of the European Union would be the prime example in this
regard. In contrast, the European Union Agency for Cy-
bersecurity (ENISA) operates at the supranational level,
although intergovernmental tenets may still be present in
terms of staffing and related aspects. While there is a
classical debate regarding the meaning of and interplay be-
tween these two theoretical governance terms (Bickerton
et al., 2022; Handler, 2024; Tsebelis and Garrett, 2021),
without a particular loss of specificity and rigor, the term
supranationalism is used in case there is no particular rea-
son to emphasize the intergovernmental dimension.
Note also a difference between the terms transnational
and intergovernmental; the latter is about relations be-
tween governments, as is the case in the Council in which
ministers or other heads of states represent their mem-
3
ber states, whereas the former can be seen to cover also
supranational governance because the meaning is essen-
tially about relations between nations. These relations
may be about states, but they may also include transna-
tional non-governmental organizations, different transna-
tional collaboration and coordination networks, and inter-
national organizations (G¨ anzle et al., 2022). When such
transnational relations are accounted for, the term multi-
level governance can be seen to cover also a horizontal
dimension; a coordination and collaboration between dif-
ferent entities not directly linked to governmental repre-
sentatives. These terminological clarifications are impor-
tant because the EU’s overall multi-level crisis manage-
ment framework covers numerous actors operating at dif-
ferent governance levels and policy areas (Anagnostakis,
2023). The concepts also provide a theoretical foundation
for analyzing the EU’s cyber security crisis management
framework in terms of governance and coordination.
2.3.3. The National, Regional, and Sectoral Levels
When taking a step downwards from the supranational
level, the national level is encountered. Regarding gover-
nance, authoritative computer security incident response
teams (CSIRTs) are particularly relevant in Europe; ac-
cording to both old and new EU laws, each member state
should have an authoritative CSIRT or a related com-
petent authority for nationwide incident management.1
However, presently it remains still somewhat unclear how
national administrations are, or will be, arranged in each
and every member state. By hypothesis, the divergence is,
or will be, large across the twenty-seven member states.
Although there are no clear demarcations, operations at
the national level are sometimes (but not always) about
crisis management rather than incident management. The
same could be said even about the regional level, espe-
cially when keeping in mind that it includes both smaller
geographically bound administrative units as well as larger
geographic units, such as is the case in the Germany’s fed-
eralist administration. Also crisis management tends to
be decentralized to the regional, L¨ ander , level in Germany,
although strategic management and high-level political co-
ordination occurs at the federal level (Christensen et al.,
2016). Without the federalist twist, the setup is rather
similar to many other European countries within which
strategic and political aspects are oftentimes centralized,
while the operational level is often more or less decen-
tralized (Christensen et al., 2016; Gjesvik, 2019; Ramsell
and Wihlborg, 2012). Regions also intervene with indus-
try sectors in many member states. Whether an exam-
ple is about the Ruhr region in Germany or the Emilia-
Romagna region in Italy, specialized industry activity has
1Here, the adjective authoritative is used for emphasizing a dif-
ference to other CSIRTs, including sectoral teams as well as teams
within organizations and companies. Note also that in practice the
abbreviation CSIRT is equivalent to an abbreviation CERT, denot-
ing a computer emergency response team.often concentrated to specific regions in Europe and also
elsewhere. Authoritative CSIRTs in some European coun-
tries have also been decentralized with sectoral special-
ization in mind (Boin et al., 2018). In terms of incident
management, many industries also have different sectoral
and regional coordination networks and governance hubs.
2.3.4. The Organizational and Individual Levels
Then, below the sectoral level is the organizational
level. As said in the introduction, this level has been
the traditional focal point in incident management and
its research. Again, coordination may occur horizon-
tally between organizations (inter-organizational coordi-
nation) and within organizations (intra-organizational co-
ordination), and vertically between organizations and in-
dividuals (Heine, 2019; Panteli et al., 2025). The intra-
organizational coordination is relevant also for establish-
ing organizational CSIRTs; typical choices for large orga-
nizations include outsourcing, a centralized organization-
wide team, or distributed teams across an organization’s
departments (Mitropoulos et al., 2006; Cichonski et al.,
2012). Organizations may also coordinate vertically with
sectoral or regional entities, such as industry associations,
as well as entities operating at a national level, including
authoritative CSIRTs in particular. Finally, as seen from
Fig. 1, it is also possible to consider incidents at a level
of individuals, whether employees, citizens, or consumers.
Given the extensive research and evidence on the human
factors in cyber security, it is also possible that an incident
affecting an individual escalates to the organizational level
or even beyond that.
2.3.5. An Example of a Multi-Level Incident
A good example about a multi-level incident would be
the attacks against Danish energy sector companies in
2023. Given that over twenty energy sector companies
were compromised, the incident prompted also interna-
tional media attention (Antoniuk, 2023). Regarding the
analytical levels, the example is illuminating because it
involved three or four levels in Fig. 1.
To begin with, the incident was not only organizational
but also sectoral due to the involvement of multiple com-
panies in the same sector. Given the potential concen-
tration of the energy sector companies to some particular
regions in Denmark, the incident could be perhaps inter-
preted to involve also the regional level. In any case, the
sectoral level manifested itself also in the investigation con-
ducted by SektorCERT (2023), a non-profit CSIRT com-
posed by Danish critical infrastructure companies and op-
erators. The investigation revealed that the compromises
were conducted by exploiting a vulnerability in a firewall
product.2Furthermore, an update had been available but
the energy sector companies had not patched their firewalls
for a reason or another. During the incident management,
the issue escalated further to the national level.
2CVE-2023-28771.
4
Among other things, CFCS (2023), the authoritative
CSIRT in Denmark, raised the threat level against the
Danish energy sector to the very high level category. How-
ever: while multiple levels were involved, the incident is
not yet something that could be interpreted as a cyber se-
curity crisis according to the EU’s laws. This point will
become clear in Subsection 3.1 that elaborates different
incident types present in the recently enacted EU laws.
2.4. The EU’s Strategy
The EU’s new cyber security strategy can be sum-
marized in the form of Fig. 2. Three of the strategy’s
pillars—prevention, detection, and response—resemble
rather similar phases in incident management frameworks.
For instance, the NIST’s noted framework is structured
around preparation, detection and analysis, containment,
eradication, and recovery, and post-incident phases (Ci-
chonski et al. 2012; cf. also Mitropoulos et al. 2006).
Rather analogously, ENISA (2024) builds upon preven-
tion, preparedness, and response and recovery phases. An-
other example would be prepare, detect and recover, and
learn (Jaatun et al., 2009). A further point is that the
EU’s strategy is structured around specific laws, which
are also supported by funding instruments, education, re-
search, development, and innovation projects, and specific
governance bodies, some of which are new.
Prevent Detect Respond Deter
  NIS2
  CRA
  CSA
  CSOACRA
CSOANIS2
CRA
CSOADiplomacy
Defense
Law enfor .International cooperation
Investments, skills, science, development, and institutions
Figure 2: The EU’s Current Cyber Security Strategy in a Nutshell
(adopted from EC 2025b)
Before continuing to enumerate the laws covered, it
should be emphasized that there are many further EU laws
explicitly or implicitly related to cyber security, some of
which are sector-specific and some others of which over-
lap with each other (EC, 2025a; Fischer-H¨ ubner et al.,
2021; Ruohonen et al., 2025). Against this backdrop, it is
no wonder that regulatory fragmentation and complexity
have been a source of commonly expressed criticism (Alex-
opoulos et al., 2025; Ruohonen, 2024b). In any case, it
should be emphasized that the specific laws considered
are particularly relevant for the paper’s topic. In other
words, as will elaborated in Section 3, the laws also help
to understand how a transcendence from an incident to a
unionwide crisis is legally perceived and structured.
Of the four laws abbreviated in Fig. 2, particularly im-
portant are the so-called NIS2 directive (EU, 2022) and
the Cyber Resilience Act (CRA) regulation (EU, 2024).Although a concept of essential and important entities
(EAIEs) is used in the NIS2 directive, the directive is es-
sentially about critical infrastructure protection. Overall,
the directive builds upon a sectoral approach; numerous
sectors are enumerated as carrying “critical societal or eco-
nomic activities”, to quote from the NIS2’s Article 2(2)(b).
This quotation aligns with the notion of societal cyber se-
curity noted in the introduction. The actual sectors spec-
ified range from traditional critical infrastructure sectors,
such as energy and transport, to banking, healthcare, fi-
nance, drinking and waste water management, the Inter-
net’s core infrastructure, and space technologies.
In contrast, the CRA regulation is a product-specific
law; among other things, it specifies so-called essential cy-
ber security requirements for almost all information tech-
nology products. As these requirements have already been
considered in detail (Ruohonen et al., 2025), including
