title,authors,year,doi,full_text,clean_text,keywords
yycbranch pisection parameters
su
ij complex power ow on line ijupper
bounds
iu
ij current ow on line ijupper bounds
l
ij branch angle difference lower bounds
u
ij branch angle difference upper bounds
 threshold value to consider bus unreliable
 cyberphysical upper bound variable
 cyberphysical lower bound variable
cqk cpesqsm score value at bus k
sg
k pg
kgenkactive power output
sg
k qg
kgenkreactive power output
vi v oltage magnitude at bus i
i v oltage angle at bus i
sij complex power ow on line ijarxiv220603543v2  eesssy  26 sep 2022
2
cpes qsm electricalfactors
pi performance index
crpi contingency ranking performance index
pflow
li power ow on line lwith lineiout
pmax
l max power rating for line l
npi pi overloaded lines parameter
vdi v oltage deviation index
vcpi v oltage collapse prediction index
svsi simplied v oltage stability index
 svsi correction factor
v v oltage difference
cpes qsm graph theoryfactors
g graph
gp physical graph
gc cyber graph
n nodes
e edges
stv origin destination and evaluated node
v set of all nodes
st total shortestpaths between sandt
duv shortestpath between node uandv
bc betweenness centrality
cc closeness centrality
ebc edge betweenness centrality
cpes qsm cyberfactors
p probability
i impact
av attack vector
ac attack complexity
ui user interaction
pr privileges required
qcrb quantitative cyber risk base
qcra quantitative cyber risk attackgraph
cpes qsm com putation
 fuzzy measure
n set of all criteria
ab subsets ofn
 empty set
 interaction index
ci choquet integral
i i ntroduction
the modernization and decentralization of electric power
systems eps are being facilitated by the integration
of distributed energy resources ders and the widescale
deployment of internetofthings iot devices and information
and communication technologies icts however this mod
ernization and transformation from old passive eps to cyber
physical energy systems cpes have their disadvantages
progressively cpes are becoming more challenging to secure
due to the incorporation of iotict devices that introduce
cyber vulnerabilities to physical systems thus creating attack
vectors not previously considered in traditional power system
operations 1recent attack incidents such as blackenergy crashover
ride and triton illustrate the growing threat of vulnerabilities
in the iotict infrastructure of power systems 2 3 one
prominent example of an attack incident affecting the power
grid is the 2015 ukraine cyberattack 4 in this case ad
versaries were able to trip important circuit breakers causing
a blackout that affected almost 225000 customers other
examples of potential threats to eps are explored in 5 6
where authors demonstrated how attackers can compromise
phasor measurement units pmus by spoong gps signals
via the use of opensource exploitation methods and open
source intelligence osint techniques
even though the electricity sector has matured in the deploy
ment of protection systems researchers and stakeholders still
struggle when quantifying the cybersecurity status and vulner
abilities of systems operating in a cpes 7 conventionally
metrics exist to quantify either the cyber or the physical
domain independently for instance in the cyber domain infor
mation technology it systems metrics such as the common
vulnerability scoring system cvss 8 exist which only
relies on it experts opinions to grade vulnerabilities based
on several factors such as attack vector and attack complexity
while cvss is useful for analyzing vulnerabilities for it sys
tems the framework is insufcient when considering critical
infrastructure systems trying to address these issues efforts
such as the cert resilience management model 9 the
mitres cyber resilience engineering framework cref
10 and the infrastructure resilience analysis methodology
iram 4 have been proposed but fail to provide sufciently
useful information to system operators due to not having direct
interpretations related to the operation of cpes
while there are metrics that compute individual physical and
cyber resiliency factors there is a lack of metrics designed
to study cyberphysical security rigorously in an integrated
manner also many of the metrics proposed in the literature
are an aggregation of existing metrics that need domain
specialists to interpret them that is why authors have focused
on addressing this lack of existing metrics by proposing
different resiliency metrics and methods specially tailored for
smallscale cpes an example is presented in 11 where
authors propose resiliency metrics that capture the level of
preparedness of a distribution system to resist extreme adverse
conditions in 12 authors propose a stochastic security
oriented risk management technique devised to estimate cyber
physical security indices tailored to measure the security level
of a cyberphysical system cps
the papers presented in 13 and 14 are the ones that are
closer to the idea proposed in this paper since the metrics and
methods proposed in these papers follow a similar formulation
based on a multicriteria decision making mcdm approach
in these papers the authors explore the concept of combining
different factors coming from different domains such as
the physical cyber and devicemanagement domains using
choquet integrals ci to compute an overall resiliency score
of the system the main differences between our proposed
approach and the methods presented in these papers are related
to the afactors considered different physical graphtheory
and cyber factors bindividual scoring metric for each
3
physical systemcyber system
 factors
attack graph
p  155 mw
p  543 mw
fig 1 over allframe work forcyberconstrained acopf cacopf operation based onthecyberphys icalenergy system quan titativesecuritymetric
cpes qsm
nodebus in the cpes thus improving visibility and human
intheloop hitl processes and cthe utilization of the
proposed cybermetric as a deciding factor to improve not only
the resilience but the overall cyberphysical security state of
ac optimal power ow acopf solutions for cpes
another major contribution of this paper is related to the
utilization of the proposed cybermetric as a factor that directly
alters the traditional acopf solutions of a cpes based on the
realtime cybersecurity status of the system and thus in a way
merging the physical and the cyber domains a limited number
of papers have explored the idea of modifying the acopf
formulation so that it can integrate the status of the cyber layer
of the cpes one example is the paper presented in 15
where authors propose a cyberconstrained opf model for
the emergency response of smart grids the proposed model
considers both the physical and cyber network by adding
cyberrelated constraints to the traditional acopf but has the
disadvantage of being a blackandwhite mapping process
that assumes the total loss of control of a physical bus mapped
to a cyberblind cyber node cyberblind meaning a cyber
node that becomes invisible due to failing another similar
paper is the one presented in 16 where authors develop a
multiagentbased algorithm designed to optimize the power
ow of a cpes based on power ow constraints derived
from community resilience factors such as levels of emotion
empathy cooperation and physical health of consumers the
community and cyberlayer factors are measured based on
social media sentiment analysis and other social and human
factors related to cognitive science and psychology
a contributions
contrasting from the papers examined this paper aims
to address the specic problem of quantitatively measuring
the realtime cyberphysical security of a cpes considering
factors that affect both its physical and cyber domains by
proposing a novel cybermetric it intends to provide an
intuitive and easytounderstand metric that can be used for
hitl operations and can directly reect the cyberphysical
status of the cpes into the acopf solutions so that the
optimization can be performed not only based on the physicalstatus of the system but considering its current cyber status
the contributions of this paper can be summarized as follows
a quantitative cyberphysical security metric for cpes is
proposed the cyberphysical energy system quantita
tive security metric cpesqsm is designed to quantify
the current cyberphysical status of every iotconnected
node in a cpes by combining factors from the electrical
it and graphtheory domains using an mcdm approach
the metric provides an easytointerpret way to evaluate
the current state of the cpes
a cyberconstrained acopf formulation that takes into
account not only the physical state of the system but
also considers the current status of its cyber domain
using the proposed cpesqsm as a proxy is proposed
the formulation is intended to restrict the opf solution
space based on the current cyber status of nodes in
the system which can make them unreliable based on
vulnerabilities or modeled attackgraphs threats targeting
iot devices deployed in the respective nodes of the cpes
experimental case studies are investigated using standard
ieee test systems to demonstrate the usefulness of the
proposed cybermetric and validate the utilization of
the cyberconstrained acopf formulation for achieving
more secure opf solutions ie considering both the
physical and cyber status the results show how the pro
posed formulation improves the security and stability of
the system when a cyberattack compromises vulnerable
nodes
fig 1 depicts the overall framework for the use of the pro
posed cpesqsm in conjunction with the cyberconstrained
acopf formulation with the objective of reaching a more
secure operating state by adjusting the systems dispatch the
gure illustrates how different factors coming from the cyber
physical and graph environments are combined into a single
quantitative score that is used to improve systems operation
the rest of the paper is organized as follows section
ii presents the proposed quantitative cyberphysical security
metric cpesqsm section iii focuses on presenting the
proposed cyberconstrained acopf formulation that makes
use of the cpesqsm as a proxy for constraining the optimal
solutions based on the cyber factors of the cpes section iv
4
presents the experimental setup and case studies performed to
evaluate the utility of the proposed cybermetric and demon
strate its effectiveness for constraining the traditional acopf
finally section v presents conclusions and future work
ii cpesqsm c omputation  f actors
this section presents the proposed quantitative cyber
physical metric cpesqsm that is designed to provide a
realtime numerical value to the cyber and physical status of an
operating cpes the cpesqsm cybermetric provides via
an easytointerpret score operating observability of individual
components andor nodes in a cpes that can be used and
interpreted by both human operators and control systems for
improving the secure and resilient operation of cpes
before the computation of the cpesqsm is presented
we need to examine the different factors that affect the nal
computation of the score since our focus is towards cpes
the factors considered cover the following three main domains
1electrical  2 it and 3 graph theorybased  within
these domains factors are also classied according to the
environment they affect the environments being considered
are 1 physical  2 cyber  and 3 network  each factor
explained in the next subsections has been categorized using
one domain and one environment additional details about
each factor are presented in table i using a similar format as
the one presented by epri in 17 18 it is important to note
that the cybermetric framework presented in this paper is not
tied to the specic factors presented throughout the manuscript
and the useroperator has the liberty to choose the factors that
heshe thinks better characterizes the physicalcybernetwork
system being analyzed
a electrical domain factors
theelectrical domain factors encompass all factors directly
related to the electrical or physical operation of the cpes
1 contingency ranking performance index crpi this
factor calculates a contingency performance index using the
fast decoupled power ow fdpf 1p1q contingency ranking
method 19 that provides information about the most suscep
tible lines and buses in a cpes the specic details for the
crpi factor are shown in table i the goal of this factor is
to calculate the performance index pi that tells which lines
are most susceptible to overload note that target represents
the objective value of the factor ie the best value is 0while
the worst is 1crpi values are scaled to the 01 range
the process for computing the crpi is based on the process
presented in 19 a pi value is assigned to each line outage
scenario that can occur in a system the denition of the pi
for a contingency outage iis
piinx
ll6i","['titativesecuritymetric', 'ijarxiv220603543v2', 'charalamboskonstantinoukaustedusaict', 'cyberconstrained', 'physicalcybernetwork', '239556900', 'icalenergy', 'multiagentbased', 'cybersecurity', 'c2c1c0']"
Digital Adoption and Cyber Security: An Analysis of Canadian Businesses,"['Joann Jasiak', 'Peter MacKenzie', 'Purevdorj Tuvaandorj']",2025,http://arxiv.org/abs/2504.12413v1,"Digital Adoption and Cyber Security: An Analysis of
Canadian Businesses∗
Joann Jasiak†Peter MacKenzie‡Purevdorj Tuvaandorj§
April 18, 2025
Abstract
This paper examines how Canadian firms balance the benefits of technology adop-
tion against the rising risk of cyber security breaches. We merge data from the 2021
Canadian Survey of Digital Technology and Internet Use and the 2021 Canadian Survey
of Cyber Security and Cybercrime to investigate the trade-off firms face when adopting
digital technologies to enhance productivity and efficiency, balanced against the poten-
tial increase in cyber security risk. The analysis explores the extent of digital technology
adoption, differences across industries, the subsequent impacts on efficiency, and associ-
ated cyber security vulnerabilities. We build aggregate variables, such as the Business
Digital Usage Score and a cyber security incidence variable to quantify each firm’s digital
engagement and cyber security risk. A survey-weight-adjusted Lasso estimator is em-
ployed, and a debiasing method for high-dimensional logit models is introduced to iden-
tify the drivers of technological efficiency and cyber risk. The analysis reveals a digital
divide linked to firm size, industry, and workforce composition. While rapid expansion of
tools such as cloud services or artificial intelligence can raise efficiency, it simultaneously
heightens exposure to cyber threats, particularly among larger enterprises.
Keywords: Cyber Security, Digital Technology, Survey Data, Lasso, Technological Ef-
ficiency, Post-Selection Inference
∗The authors thank participants at the 58th Annual Conference of the Canadian Economics Association,
the 39th Annual Meeting of the Canadian Econometrics Study Group (CESG), and the Bank of Canada
Workshop on Understanding and Correcting for Non-Response Bias for their helpful comments. The authors
also gratefully acknowledge access to data provided by the RDC and Statistics Canada (Project 21-MAPA
YRK-721).
†York University, jasiakj@yorku.ca
‡York University, petem9@yorku.ca
§York University, tpujee@yorku.ca
1arXiv:2504.12413v1  [econ.GN]  16 Apr 2025
1 Introduction
The digital transformation of business operations is reshaping the Canadian economy, offering
opportunities for increased productivity and innovation. For businesses, adopting digital tech-
nologies is no longer optional; it is essential for maintaining competitiveness in a globalized
market. However, with greater reliance on digital tools comes an increased exposure to cyber
security risks. Understanding this trade-off —the efficiency gains from digital adoption versus
the vulnerabilities it introduces is critical for Canadian businesses.
This study examines the extent of digital technology adoption and cyber security prac-
tices among Canadian firms, using a novel dataset that combines information from the 2021
Canadian Survey of Digital Technology and Internet Use (SDTIU) and the 2021 Canadian
Survey of Cyber Security and Cybercrime (CSCSC). To our knowledge, this is the first study
to analyze the most recent version of the CSCSC dataset, offering an opportunity to explore
both digital adoption and cyber security. These surveys provide detailed data on firms’ adop-
tion of advanced technologies such as cloud computing, artificial intelligence, and enterprise
management systems, as well as the frequency, severity, and impact of cyber security incidents
on business operations.
The primary objective of this paper is to explore the trade-off between digital adoption and
cyber security risk, by examining how technological advancement can enhance productivity
while simultaneously increasing firms’ vulnerability to cyber threats. Specifically, we analyze
which types of firms are adopting digital technologies, how adoption levels vary across indus-
tries, and whether these technologies are increasing cyber security incidents. We also inves-
tigate the firm-specific factors such as size, industry, and employee characteristics that shape
both technological efficiency and the ability to manage cyber security risks. Our methodolog-
ical contributions include introducing the Business Digital Usage Score (BDUS) to quantify
digital adoption, enabling a comparative analysis of firms’ engagement with digital technolo-
gies.
Given the large number of firms and the high dimensionality of mostly qualitative ex-
planatory variables in our dataset, we introduce high-dimensional logit models estimated via
a Lasso-penalized maximum likelihood estimator with survey weights to ensure representa-
tiveness of Canadian firms. We use a debiasing method for inference on the selected model’s
coefficients and establish its asymptotic validity. To assess how closely firms operate to their
technological usage frontier, we apply stochastic frontier analysis. Additionally, we employ k-
means clustering to categorize firms by technological efficiency, facilitating the identification
2
of distinct profiles of digital adoption and efficiency.
The literature on digital technology adoption emphasizes its role in improving firm pro-
ductivity. Larger firms are often better positioned to implement these technologies, benefiting
from economies of scale and greater access to resources (Leung et al., 2008). In contrast,
smaller firms frequently encounter barriers, including high costs of implementation and lim-
ited technical expertise, which can hinder their ability to fully realize the potential benefits
of digital adoption. Ferrari (2012) demonstrates that industry-specific differences in digital
readiness significantly affect adoption rates, while Aghimien et al. (2021) highlight the role
of regional policies in either enabling or constricting firms’ technological advancement. To-
gether, these studies emphasize the structural factors shaping disparities in digital technology
adoption across firms.
In Canada, Bilodeau et al. (2019), using data from the 2017 CSCSC, show the widespread
reliance of Canadian businesses on digital technologies. They report that about 92% of Cana-
dian businesses used one or more digital technologies or services in 2017, with significant
increases in the adoption of websites and social media integration since 2013. In addition,
just over one-fifth of Canadian businesses reported being impacted by cyber security incidents
that affected their operations, with 54% noting that these incidents prevented employees from
carrying out day-to-day work and about 30% experiencing additional repair or recovery costs.
While digital adoption can boost productivity, it also introduces new risks, particularly
related to cyber security. The Geneva Association, a leading international think tank of
the insurance industry, defines cyber risks as breaches in confidentiality, availability, and
data integrity, posing operational threats to firms that increasingly rely on interconnected
digital systems (Eling et al., 2016). Cebula and Young (2010) expand on this definition,
framing cyber risks as disruptions that extend beyond information technology (IT) systems to
affect broader business stability. In Canada, the Toronto Public Library system experienced
significantdisruptionsfollowingacyberattack, whiletheNovaScotiaHealthDepartmentfaced
operational delays and data breaches during a similar event (Bridge and Zoledziowski, 2024;
Bousquet, 2023).
The adoption of advanced technologies such as Internet of Things (IoT) and enterprise
management systems could increase cyber security risks. Blichfeldt and Faullant (2021) high-
light that while these systems can improve productivity, their complexity often introduces
integration challenges that, if poorly managed, can undermine business operations. Addition-
ally, the widespread use of interconnected devices has expanded the potential attack surface
for cybercriminals, requiring firms to invest more heavily in cyber security infrastructure.
3
Remote work adoption during the COVID-19 pandemic accelerated the reliance on digital
tools but also introduced new risks and challenges. Hackney et al. (2022) find that firms
effectively utilizing digital technologies during the pandemic demonstrated resilience in main-
taining operations under lockdown conditions. However, Aczel et al. (2021) and Kitagawa
et al. (2021) report that the rapid shift to remote work led to heightened employee burnout
and increased risks of phishing attacks, underscoring the broader implications of accelerated
digital adoption.
Cyber insurance is a tool for mitigating cyber security risks. According to the OECD
(OECD, 2017), the cyber insurance market doubled in size between 2015 and 2020, fueled by
firms’ increasing awareness of cyber threats. However, Fitch Ratings (Fitch Ratings, 2021)
highlights that high premiums and restrictive coverage policies hinder adoption, especially
among smaller firms. Globally, cyber security spending is projected to surpass $170 billion by
2026 (Gartner, Inc., 2021).
Despite the growing demand for cyber insurance, firms may strategically underinvest in
cyber security measures due to the unobservable nature of such investments. Ahnert et al.
(2022) argue that firms may prioritize visible innovations over less transparent risk mitigation
strategies, as clients are often unable to directly evaluate cyber security expenditures. This
dynamic creates a paradox in which firms recognize the increasing risks of digital adoption
but fail to allocate sufficient resources to mitigate them effectively.
The paper is organized as follows. Section 2 describes the datasets used in the study, the
SDTIU and the CSCSC, as well as the construction of the associated scores and variables.
Section 3 outlines the paper’s main contribution and methodological framework: the survey-
weighted debiased logit Lasso method. Section 4 presents the empirical results, discussing the
key determinants of technological efficiency and cyber security vulnerabilities. We conclude
in Section 5 with a discussion of the implications of our findings for Canadian businesses
and policymakers. The appendix is divided into two parts: Appendix A provides additional
technical details on the survey-weighted debiased logit Lasso model, and Appendix B outlines
the questions that comprise the BDUS and the Cyber Security Incidence indicator.
2 Data Description and Variable Construction
The empirical analysis is based on a merged dataset from two Statistics Canada surveys: the
2021 SDTIU and the 2021 CSCSC. These surveys were merged using firm size and industry
4
classifications from the North American Industry Classification System (NAICS), enabling an
integrated study of digital adoption and cyber security risks among Canadian businesses.1
The SDTIU focuses on digital technology adoption, including metrics such as internet
usage, e-commerceparticipation, andICTadoption, whiletheCSCSCexaminescybersecurity
practices and the impact of cyber incidents on businesses. The merged dataset includes both
qualitative variables, such as the implementation of specific technologies and cyber security
measures, and quantitative variables, such as cyber security expenditure and incident-related
costs. Together, the surveys cover numerous variables relevant to digital adoption and cyber
security. The firms vary in size, ranging from small enterprises with fewer than 10 employees
to large corporations with over 500 employees. The industries covered include manufacturing,
retail, professional services, and information technology.
Both surveys apply stratified sampling by industry and firm size, with survey weights
correctingforselectionprobabilities,non-responses,andsamplingbiases. Theseweightsensure
that the results are representative of the broader population of Canadian enterprises. The
SDTIU achieved a response rate of 73%, while the CSCSC had a response rate of 65%. The
pre-matched weighted samples cover 327,567 enterprises for the SDTIU and 185,644 for the
CSCSC. After merging, the final dataset comprises a weighted sample of 179,657 enterprises,
ensuring comprehensive coverage across various business demographics.
Below, we introduce aggregate measures of digital technology usage: BDUS in Section
2.1, a separate measure of Business Technological Efficiency (based on k-means clustering) in
Section 2.2, which examines whether firms encounter significant challenges in implementing
the technologies they adopt, and an indicator for Cyber Security Incidence in Section 2.3.
2.1 Business Digital Usage Score
The BDUS is a quantitative variable constructed to evaluate the digital engagement of Cana-
dian firms by measuring the technologies they have adopted. It condenses responses from the
